{"status":"completed","summary":"Final TinyStories-8M behavioral trajectories completed in bounded job `final_behavior` for run `final_training_20260620T053855Z`. All four required conditions completed in priority order with 11/11 evaluations and checkpoint hash sets each. Final LLC was not inspected; checkpoint selection is frozen from behavior only: selected tokens `[0, 100000, 400000, 1500000, 5000000, 8000000]`. State/gate update committed as `83b12ac`; runner/config source commit was `98913e9`.","files_changed":["configs/final_tinystories8m_20260620.json","scripts/final_training.py","tests/test_final_training.py","state/current_status.json","state/decision_log.md","state/experiment_registry.csv"],"commands_run":["HF_HUB_OFFLINE=1 TRANSFORMERS_OFFLINE=1 offline TinyStories-8M load check","python -m py_compile scripts/final_training.py","python -m unittest tests.test_final_training","infra/remote/run_bounded_job.sh --name final_behavior --max-hours 5.50 --auto-stop-vm no -- env HF_HUB_OFFLINE=1 TRANSFORMERS_OFFLINE=1 .venv-bench-py311/bin/python scripts/final_training.py ...","artifact sanity check for 4 condition summaries, 44 evaluations, checkpoint hashes, wrapper exit code"],"gate_decision":"proceed","requires_human_approval":false,"approval_reason":"Standing unattended orchestrator pre-authorization is recorded in state/decision_log.md; observed/projected costs stayed under the hard cap.","estimated_incremental_gpu_hours":0.14245764447749984,"estimated_incremental_cost_usd":0.14245764447749984,"next_action":"Run the LLC campaign using the frozen behavior outputs and selected checkpoint subset; do not retune per checkpoint.","evidence_paths":["results/02_final_training/final_training_20260620T053855Z/manifest.json","results/02_final_training/final_training_20260620T053855Z/phase_report.md","results/02_final_training/final_training_20260620T053855Z/cost_projection.json","results/02_final_training/final_training_20260620T053855Z/llc_checkpoint_selection.json","results/02_final_training/final_training_20260620T053855Z/jobs/final_behavior","state/current_status.json","state/decision_log.md","state/experiment_registry.csv"]}