{"status":"completed","summary":"Final behavior trajectories and checkpoint-selection rules were confirmed frozen. The LLC campaign completed for selected tokens [0, 100000, 400000, 1500000, 5000000, 8000000] using one global FP32 full-parameter sampler config. Five checkpoints are reportable with diagnostics; token 0 was explicitly rejected for persistent downhill movement below center. No formal phase-transition claim was made.","files_changed":["scripts/llc_campaign.py","tests/test_llc_campaign.py","state/current_status.json","state/decision_log.md","state/experiment_registry.csv"],"commands_run":[".venv-bench-py311/bin/python -m unittest tests.test_llc_campaign tests.test_final_training tests.test_scientific_pilot","git commit -m \"Add final LLC campaign runner\"","git commit -m \"Fix LLC campaign direct execution\"","infra/remote/run_bounded_job.sh --name final_llc --max-hours 4.75 -- ... scripts/llc_campaign.py ... --batch-size 16","artifact integrity check for raw traces, diagnostics, running estimates, displacement, and report-source tables","git commit -m \"Record final LLC campaign gate\""],"gate_decision":"proceed","requires_human_approval":false,"approval_reason":"Standing unattended orchestrator pre-authorization applied; final projected total cost remained below hard cap.","estimated_incremental_gpu_hours":0.6029461090447225,"estimated_incremental_cost_usd":0.6029461090447225,"next_action":"Build the real report from report-source tables and raw diagnostics.","evidence_paths":["results/03_llc_campaign/llc_campaign_final_training_20260620T053855Z_batch16/phase_report.md","results/03_llc_campaign/llc_campaign_final_training_20260620T053855Z_batch16/manifest.json","results/03_llc_campaign/llc_campaign_final_training_20260620T053855Z_batch16/llc_campaign_summary.json","results/03_llc_campaign/llc_campaign_final_training_20260620T053855Z_batch16/report_source_tables/llc_summary.csv","results/03_llc_campaign/llc_campaign_final_training_20260620T053855Z_batch16/report_source_tables/sampler_diagnostics.csv","results/03_llc_campaign/llc_campaign_final_training_20260620T053855Z_batch16/raw_traces","results/03_llc_campaign/llc_campaign_final_training_20260620T053855Z_batch16/running_estimates","results/03_llc_campaign/llc_campaign_final_training_20260620T053855Z_batch16/displacement","results/03_llc_campaign/llc_campaign_final_training_20260620T053855Z_batch16/failures/tokens_000000000.json","state/current_status.json","state/decision_log.md","state/experiment_registry.csv"]}