{"status":"completed","summary":"Infrastructure gate passed/ready_for_pilot on fresh GPU-visible run `infra_gate_20260620T052138Z`. NVIDIA L4 was visible to `nvidia-smi` and PyTorch; TinyStories-3M forward/backward and train-save-reload-evaluate-sample loop completed; seq64 mean step 0.0389s, seq128 mean step 0.0744s; sampler smoke wrote 9.55MB zarr traces. Minimum observed VRAM headroom was 82.3%, above the 25% gate. Revised project estimate is 3.53 median charged hours / $3.53 at the $1/h planning assumption; review_required=false. No final scientific run was launched. Source job commit: e2dc7f1. Phase state commit: 4a73f86.","files_changed":["scripts/tinystories_gate_loop.py","tests/test_tinystories_gate_loop.py","state/current_status.json","state/decision_log.md","state/experiment_registry.csv","results/00_infrastructure_gate/infra_gate_20260620T052138Z/phase_report.md"],"commands_run":["python3 -m unittest tests.test_cuda_diagnostics tests.test_tinystories_gate_loop",".venv-bench-py311/bin/python -m unittest tests.test_cuda_diagnostics tests.test_tinystories_gate_loop","git commit -m \"Prepare infrastructure gate rerun\"","nvidia-smi and torch CUDA preflight","infra/remote/run_bounded_job.sh --name check_environment --max-hours 0.20 -- .venv-bench-py311/bin/python scripts/check_environment.py ...","infra/remote/run_bounded_job.sh --name tinystories_loop --max-hours 0.25 -- .venv-bench-py311/bin/python scripts/tinystories_gate_loop.py ...","infra/remote/run_bounded_job.sh --name train_seq64 --max-hours 0.25 -- .venv-bench-py311/bin/python scripts/benchmark_train.py ... --sequence-length 64","infra/remote/run_bounded_job.sh --name train_seq128 --max-hours 0.25 -- .venv-bench-py311/bin/python scripts/benchmark_train.py ... --sequence-length 128","infra/remote/run_bounded_job.sh --name sampler_smoke --max-hours 0.25 -- .venv-bench-py311/bin/python scripts/benchmark_sampler.py ...","python scripts/estimate_project.py --train-benchmark .../train_seq128.json --sampler-benchmark .../sampler_smoke.json","git commit -m \"Record infrastructure gate pass\""],"gate_decision":"proceed","requires_human_approval":false,"approval_reason":"Unattended orchestration pre-authorization applies, and the fresh project estimate is below both 10 charged hours and $35 before contingency.","estimated_incremental_gpu_hours":0.0419,"estimated_incremental_cost_usd":0.0419,"next_action":"Proceed only to the scientific pilot gate with bounded jobs; do not launch the final scientific run.","evidence_paths":["results/00_infrastructure_gate/infra_gate_20260620T052138Z/check_environment.json","results/00_infrastructure_gate/infra_gate_20260620T052138Z/tinystories_loop/loop_metrics.json","results/00_infrastructure_gate/infra_gate_20260620T052138Z/train_seq64.json","results/00_infrastructure_gate/infra_gate_20260620T052138Z/train_seq128.json","results/00_infrastructure_gate/infra_gate_20260620T052138Z/sampler_smoke.json","results/00_infrastructure_gate/infra_gate_20260620T052138Z/sampler_smoke.zarr","results/00_infrastructure_gate/infra_gate_20260620T052138Z/project_estimate.json","results/00_infrastructure_gate/infra_gate_20260620T052138Z/phase_report.md","results/00_infrastructure_gate/infra_gate_20260620T052138Z/jobs"]}