{"status":"completed","summary":"Built and committed the empirical report phase from the specified real final-training and LLC batch16 artifacts only. Commit: 8888d5e. Report package is under results/04_report/report_20260620T064400Z_final_training_20260620T053855Z_batch16 with report.md, report.pdf, source tables, figures, source_links.json, checkpoint hashes, and validation artifacts. Validation passed with 225 verified displayed table cells and mock_reference_count=0. The report includes the token-0 LLC rejection and explicitly does not claim a formal SLT phase transition, grokking, causality, or a changepoint in an SLT-derived local geometric estimate aligned with a behavioral transition.","files_changed":["scripts/build_report.py","tests/test_report_builder.py","state/current_status.json","state/decision_log.md","state/experiment_registry.csv","results/04_report/report_20260620T064400Z_final_training_20260620T053855Z_batch16/"],"commands_run":[".venv-bench-py311/bin/python scripts/build_report.py --run-id report_20260620T064400Z_final_training_20260620T053855Z_batch16 --output-dir results/04_report/report_20260620T064400Z_final_training_20260620T053855Z_batch16",".venv-bench-py311/bin/python -m unittest tests.test_report_builder tests.test_final_training tests.test_llc_campaign","rg -n \"reference/mock_report|synthetic_\" results/04_report/report_20260620T064400Z_final_training_20260620T053855Z_batch16 state/current_status.json state/decision_log.md state/experiment_registry.csv","git commit -m \"Build empirical report from final artifacts\""],"gate_decision":"proceed","requires_human_approval":false,"approval_reason":"","estimated_incremental_gpu_hours":0,"estimated_incremental_cost_usd":0,"next_action":"Operator review or submission packaging; no further GPU work is required by the report phase.","evidence_paths":["results/04_report/report_20260620T064400Z_final_training_20260620T053855Z_batch16/report.pdf","results/04_report/report_20260620T064400Z_final_training_20260620T053855Z_batch16/report.md","results/04_report/report_20260620T064400Z_final_training_20260620T053855Z_batch16/validation/validation_summary.json","results/04_report/report_20260620T064400Z_final_training_20260620T053855Z_batch16/validation/table_cell_verification.csv","results/04_report/report_20260620T064400Z_final_training_20260620T053855Z_batch16/source_links.json","results/04_report/report_20260620T064400Z_final_training_20260620T053855Z_batch16/phase_report.md"]}