{"status":"blocked","summary":"Diagnosed the blocker without launching training. The active shell Python is missing the ML stack, but the existing `.venv-bench-py311/bin/python` has the required packages and CUDA-enabled PyTorch. CUDA still fails there: `nvidia-smi` exits 9, `/dev/nvidia0` and `/dev/nvidiactl` are absent, `nvidia-modprobe -u -c=0` exits 1, and PyTorch sees zero CUDA devices. This is an operator-side GPU device-node/driver initialization blocker, not a Python package reinstall issue. I updated the diagnostic classifier and CPU smoke test so missing active-shell PyTorch is no longer mislabeled as a CPU-only wheel.","files_changed":["scripts/check_environment.py","tests/test_cuda_diagnostics.py","state/current_status.json","state/decision_log.md","state/experiment_registry.csv","results/00_infrastructure_gate/cuda_worker_diag_20260620T051003Z/phase_report.md","results/00_infrastructure_gate/cuda_worker_diag_20260620T051003Z/worker_shell_python_env.log","results/00_infrastructure_gate/cuda_worker_diag_20260620T051003Z/driver_device_probe.log","results/00_infrastructure_gate/cuda_worker_diag_20260620T051003Z/check_environment_system_python.json","results/00_infrastructure_gate/cuda_worker_diag_20260620T051003Z/check_environment_venv_bench_py311.json","results/00_infrastructure_gate/cuda_worker_diag_20260620T051003Z/torch_cuda_visibility_venv_bench_py311.json"],"commands_run":["sed -n '1,240p' AGENTS.md","tail -n 120 state/decision_log.md","find results/_jobs -maxdepth 2 -type f | sort | tail -n 80","sed -n '1,260p' results/_codex/exec-diagnose_and_fix-002/prompt.md","for d in results/_jobs/*; do ... inspect command/status/exit/log ...; done","probe active python, venv candidates, nvidia-smi, /dev/nvidia*, /proc/driver/nvidia/version, lsmod, lspci","probe torch/package/CUDA visibility in python3, .venv, .venv-py311, .venv-bench-py311","python3 -m unittest tests.test_cuda_diagnostics",".venv-bench-py311/bin/python -m unittest tests.test_cuda_diagnostics","python3 scripts/check_environment.py --output /tmp/check_environment_system.json",".venv-bench-py311/bin/python scripts/check_environment.py --output /tmp/check_environment_venv.json","write fresh diagnostic artifacts under results/00_infrastructure_gate/cuda_worker_diag_20260620T051003Z","python3 -m json.tool state/current_status.json","python3 -m json.tool results/00_infrastructure_gate/cuda_worker_diag_20260620T051003Z/check_environment_venv_bench_py311.json","python3 CSV registry validation"],"gate_decision":"stop","requires_human_approval":false,"approval_reason":"","estimated_incremental_gpu_hours":0,"estimated_incremental_cost_usd":0,"next_action":"Operator-side VM stop/start or reboot, then rerun the official Google GPU driver installer if `nvidia-smi` still fails. After that, verify `nvidia-smi` and PyTorch CUDA visibility from `.venv-bench-py311/bin/python`, then rerun only the infrastructure gate.","evidence_paths":["results/_codex/exec-diagnose_and_fix-002/prompt.md","results/00_infrastructure_gate/cuda_worker_diag_20260620T051003Z/phase_report.md","results/00_infrastructure_gate/cuda_worker_diag_20260620T051003Z/driver_device_probe.log","results/00_infrastructure_gate/cuda_worker_diag_20260620T051003Z/check_environment_venv_bench_py311.json","results/00_infrastructure_gate/cuda_worker_diag_20260620T051003Z/check_environment_system_python.json","results/00_infrastructure_gate/cuda_worker_diag_20260620T051003Z/torch_cuda_visibility_venv_bench_py311.json","state/current_status.json","state/decision_log.md","state/experiment_registry.csv"]}