{"status":"completed","summary":"Recipe found. Winning recipe: TinyStories-8M full-parameter FP32 AdamW, lr 1e-4, 3% warmup, cosine decay, grad clip 1.0, weight decay 0.01, batch 64, 1,007,616 tokens per condition using fresh Wikipedia-PT chunks and fixed pilot validation. Structured PT BPB decreased 6.773542 -> 3.806601; shuffled final BPB was 4.214080, so structured finished better by 0.407478 BPB. Recommend continuing this recipe from the structured checkpoint to a larger token budget; no scale-up was started.","files_changed":["scripts/recipe_search.py","tests/test_recipe_search.py","state/current_status.json","state/decision_log.md","state/experiment_registry.csv"],"commands_run":[".venv-bench-py311/bin/python -m unittest tests.test_recipe_search",".venv-bench-py311/bin/python -m py_compile scripts/recipe_search.py","JOB_ROOT=results/recipe_search/recipe_search_20260620T171838Z_lr1e-4_wiki1m/jobs infra/remote/run_bounded_job.sh --name recipe_attempt --max-hours 0.22 --auto-stop-vm no -- .venv-bench-py311/bin/python scripts/recipe_search.py --output-dir results/recipe_search/recipe_search_20260620T171838Z_lr1e-4_wiki1m --learning-rate 1e-4 --warmup-fraction 0.03 --lr-schedule cosine --grad-clip 1.0 --weight-decay 0.01 --batch-size 64 --target-tokens 1000000 --checkpoint-tokens 0,100000,250000,500000,1000000 --max-docs 2048 --device cuda --local-files-only"],"gate_decision":"proceed","requires_human_approval":true,"approval_reason":"Recipe found; do not start a larger token-budget continuation until operator greenlight.","estimated_incremental_gpu_hours":0.02113312605222221,"estimated_incremental_cost_usd":0.02113312605222221,"next_action":"Stop for operator greenlight; continue this recipe from the structured checkpoint to a larger token budget.","evidence_paths":["results/recipe_search/recipe_search_20260620T171838Z_lr1e-4_wiki1m/manifest.json","results/recipe_search/recipe_search_20260620T171838Z_lr1e-4_wiki1m/phase_report.md","results/recipe_search/recipe_search_20260620T171838Z_lr1e-4_wiki1m/data_splits/split_manifest.json","results/recipe_search/recipe_search_20260620T171838Z_lr1e-4_wiki1m/conditions/structured_pt/condition_summary.json","results/recipe_search/recipe_search_20260620T171838Z_lr1e-4_wiki1m/conditions/shuffled_pt/condition_summary.json","results/recipe_search/recipe_search_20260620T171838Z_lr1e-4_wiki1m/conditions/structured_pt/checkpoints/tokens_001000000"]}