{"status":"completed","summary":"Confirmed the fresh infrastructure gate passed, implemented the TinyStories-3M scientific pilot, committed it, ran the bounded pilot only, and recorded a structured proceed gate decision without launching 8M. Pilot run scientific_pilot_20260620T053047Z completed exit 0 in 44.99s: structured PT BPB 6.4532 -> 4.1498, shuffled PT final BPB 4.3511, English BPB 2.6944 -> 2.7762, grammar accuracy 0.8 with sanity checks passed, and fixed-config early/middle/late LLC zarr traces preserved. State and registry updates are committed as dd21d28; pilot source commit is 5c3cd8e.","files_changed":["scripts/scientific_pilot.py","tests/test_scientific_pilot.py","state/current_status.json","state/decision_log.md","state/experiment_registry.csv"],"commands_run":[".venv-bench-py311/bin/python -m unittest tests.test_scientific_pilot",".venv-bench-py311/bin/python -m py_compile scripts/scientific_pilot.py","git commit -m \"Add TinyStories scientific pilot runner\"","JOB_ROOT=results/01_scientific_pilot/scientific_pilot_20260620T053047Z/jobs infra/remote/run_bounded_job.sh --name pilot --max-hours 1.10 --auto-stop-vm no -- .venv-bench-py311/bin/python scripts/scientific_pilot.py ...","git commit -m \"Record TinyStories scientific pilot gate\""],"gate_decision":"proceed","requires_human_approval":false,"approval_reason":"","estimated_incremental_gpu_hours":0.0125,"estimated_incremental_cost_usd":0.0125,"next_action":"Return control to the orchestrator/planner for the next bounded gate; do not launch TinyStories-8M from this tick.","evidence_paths":["results/00_infrastructure_gate/infra_gate_20260620T052138Z/phase_report.md","results/01_scientific_pilot/scientific_pilot_20260620T053047Z/gate_decision.json","results/01_scientific_pilot/scientific_pilot_20260620T053047Z/phase_report.md","results/01_scientific_pilot/scientific_pilot_20260620T053047Z/manifest.json","results/01_scientific_pilot/scientific_pilot_20260620T053047Z/data_splits/split_manifest.json","results/01_scientific_pilot/scientific_pilot_20260620T053047Z/llc_cross_check/llc_cross_check_summary.json","results/01_scientific_pilot/scientific_pilot_20260620T053047Z/jobs/pilot"]}